"Araszkiewicz M.","36682023500;","Time, trust and normative change. On certain sources of complexity in judicial decision-making",2014,"Lecture Notes in Computer Science (including subseries Lecture Notes in Artificial Intelligence and Lecture Notes in Bioinformatics)","8929",,,"100","114",,1,"10.1007/978-3-662-45960-7","https://www.scopus.com/inward/record.uri?eid=2-s2.0-84919460834&doi=10.1007%2f978-3-662-45960-7&partnerID=40&md5=c1394b6a2b5da96b01f24f4caad045c7","Jagiellonian University, Department of Legal Theory, Bracka 12, Kraków, 31-005, Poland","Araszkiewicz, M., Jagiellonian University, Department of Legal Theory, Bracka 12, Kraków, 31-005, Poland","The aim of this paper is to outline a structure of legal knowledge that is involved in resolution of complex legal cases comprising intertemporal issues and constitutional problems. Although the topics of dynamics of legal systems are already well-elaborated in the AI and Law literature, the problem of constitutional admissibility of certain types of changes to the legal systems remains an underexplored issue. The model developed in this paper is designed to fill in this gap. The meta-information concerning admissibility of certain changes to legal systems (with regard to relevant constitutional principles) should become a standard element of any well-developed database of statutory legal knowledge. © Springer-Verlag Berlin Heidelberg 2014.","Case-based reasoning; Constitutional review; Principles; Rule-based reasoning; Time trust","Case based reasoning; Decision making; Legal case; Legal knowledge; Legal system; Meta information; Principles; Rule based reasoning; Standard elements; Time trust; Laws and legislation","Araszkiewicz, M.; Jagiellonian University, Department of Legal Theory, Bracka 12, Poland",,"Springer Verlag",03029743,,,,"English","Lect. Notes Comput. Sci.",Article,"Final","",Scopus,2-s2.0-84919460834
"Cyril Naves S.","42962028100;","Analytic hierarchy process integrated hybrid agent system for intelligent legal assistance",2011,"IAMA 2011 - 2011 2nd International Conference on Intelligent Agent and Multi-Agent Systems",,,"6049001","41","45",,1,"10.1109/IAMA.2011.6049001","https://www.scopus.com/inward/record.uri?eid=2-s2.0-80955141255&doi=10.1109%2fIAMA.2011.6049001&partnerID=40&md5=0e4f5fb95b2d03b0f5ae988c1fe019f8","Department of Information Technology, Sri Sairam Institute of Technology, Anna University, Chennai, India","Cyril Naves, S., Department of Information Technology, Sri Sairam Institute of Technology, Anna University, Chennai, India","Legal systems developed around the world tend to be very complex in the eyes of a common man with no idea as to how to approach a judiciary seeking justice or exhibiting his right to information about a particular law. Mostly a man with a need for judicial assistance approaches with an advocate to deal with his case, but this may not be useful when a person is interested in knowing and applying the exact law approach to petty issues in his life and also to avoid being a scapegoat at sometimes by few advocates who elongates the case system for his benefits. The proposed approach has an intelligent hybrid agent system composed of two subsystems, law gatherer and law decider to address the two key issues, finding out right laws and making a right choice. The law gatherer subsystem is based on the ontology web service architecture to define the ontology which is used for processing the semantic content of gathered law information. The law gatherer subsystem is composed of a knowledge system that combines Case-Based Reasoning (CBR) and Rule-Based Reasoning (RBR). Simple Object Access protocol (SOAP) is used for establishing the communication interface and gathering XML-based contents between the agent system and the database system created, through remote procedure calls with condition parameters. In the second subsystem Law Decider, the Analytic Hierarchy Process which is a structured technique for dealing with complex decisions is used to make an optimal decision for satisfying the case structure of the individual. The proposed Hybrid agent system will assist the people with no judicial knowledge to feed their case details into the system to get the appropriate law suitable for that particular instance. © 2011 IEEE.","Analytic Hierarchy Process; Artificial Intelligence; case-based reasoning; Intelligent Agent; Ontology; rule-based systems; Web Service","Agent systems; Case structures; CBr; Communication interface; Complex decision; Condition parameters; Hybrid agents; Knowledge system; Law approach; Legal system; Ontology web services; Optimal decisions; Remote Procedure Call; Rule based reasoning; Rule based system; Semantic content; Simple object access protocols; Analytic hierarchy process; Case based reasoning; Database systems; Hierarchical systems; Intelligent agents; Internet protocols; Laws and legislation; Ontology; Semantic Web; Semantics; User interfaces; Web services; Multi agent systems","Cyril Naves, S.; Department of Information Technology, , Chennai, India; email: cyrilnaves91@gmail.com",,,,9781457708787,,,"English","IAMA - Int. Conf. Intelligent Agent Multi-Agent Syst.",Conference Paper,"Final","",Scopus,2-s2.0-80955141255
[No author name available],[No author id available],"Case-Based Reasoning Research and Development - 8th International Conference on Case-Based Reasoning, ICCBR 2009, Proceedings",2009,"Lecture Notes in Computer Science (including subseries Lecture Notes in Artificial Intelligence and Lecture Notes in Bioinformatics)","5650 LNAI",,,"","",536,1,,"https://www.scopus.com/inward/record.uri?eid=2-s2.0-70350764610&partnerID=40&md5=9bb9442e531fe1c94021b262c32e2f73",,"","The proceedings contain 36 papers. The topics discussed include: case-based reasoning in transfer learning; toward modeling and teaching legal case-based adaptation with expert examples; opportunistic adaptation knowledge discovery; improving reinforcement learning by using case based heuristics; dimensions of case-based reasoner quality management; an active approach to automatic case generation; boosting CBR agents with genetic algorithms; using meta-reasoning to improve the performance of case-based planning; multi-level abstractions and multi-dimensional retrieval of cases with time series features; on similarity measures based on a refinement lattice; constraint-based case-based planning using weighted MAX-SAT; a value supplementation method for case bases with incomplete information; efficiently implementing episodic memory; and determining root causes of drilling problems by combining cases and general knowledge.",,,,,,03029743,3642029973; 9783642029974,,,"English","Lect. Notes Comput. Sci.",Conference Review,"Final","",Scopus,2-s2.0-70350764610
"Aha D.W.","6701853513;","Conversational case-based reasoning",2005,"Lecture Notes in Computer Science (including subseries Lecture Notes in Artificial Intelligence and Lecture Notes in Bioinformatics)","3776 LNCS",,,"30","",,1,"10.1007/11590316_4","https://www.scopus.com/inward/record.uri?eid=2-s2.0-33646729504&doi=10.1007%2f11590316_4&partnerID=40&md5=833181c430c5324b400a1cd39dfc8c92","Intelligent Decision Aids Group, Navy Center for Applied Research in Artificial Intelligence, Naval Research Laboratory (Code 5515), Washington, DC 20375, United States","Aha, D.W., Intelligent Decision Aids Group, Navy Center for Applied Research in Artificial Intelligence, Naval Research Laboratory (Code 5515), Washington, DC 20375, United States","Case-based reasoning (CBR) is a problem solving methodology that focuses on reusing lessons obtained from previous (possibly generalized) experiences towards solving new problems (Kolodner, 1993; Aamodt & Plaza, 1994; Watson, 1999; Bergmann, 2002). Originally conceived by cognitive scientists, since 1993 the CBR community has focused primarily on issues of interest to artificial intelligence researchers and practitioners. Some research topics of particular interest include case representation and indexing, solution retrieval and adaptation, learning (e.g., case acquisition), and integrating case-based approaches with others. Some motivating applications have included those related to customer support, recommender systems, knowledge management, diagnosis, the health sciences, and legal reasoning. Among these areas, most deployed CBR applications have been for the customer support niche of help-desk systems. These applications have the characteristic that problem descriptions are incrementally elicited from a user rather than available in complete form a priori. This category of CBR approaches is referred to as conversational (Aha et al., 2001) because they use a dialogue with the end user to identify the problem to be solved. Many case-based diagnosis and recommendation systems have used a conversational CBR (CCBR) methodology, and met with considerable success. In this presentation, I will introduce the CCBR methodology, describe its evolution, examine its various manifestations and their motivations, highlight recent work, and describe unsolved issues that could be the focus of enlightened dissertations. © Springer-Verlag Berlin Heidelberg 2005.",,"Artificial intelligence researchers; Case-based reasoning (CBR); Conversational case-based reasoning; Help-desk systems; Artificial intelligence; Cognitive systems; Health care; Information retrieval; Knowledge acquisition; Knowledge representation; Problem solving; Professional aspects; Research and development management; Speech processing; Formal logic","Aha, D.W.; Intelligent Decision Aids Group, , Washington, DC 20375, United States; email: david.aha@nrl.navy.mil",,,03029743,3540305068; 9783540305064,,,"English","Lect. Notes Comput. Sci.",Conference Paper,"Final","All Open Access, Bronze",Scopus,2-s2.0-33646729504
"Gray P.N., Mann S.","19337202400;56129385500;","The Fraunce (1588) model of case-based reasoning",2003,"Proceedings of the International Conference on Artificial Intelligence and Law",,,"1047807","89","90",,1,"10.1145/1047788.1047807","https://www.scopus.com/inward/record.uri?eid=2-s2.0-77957775592&doi=10.1145%2f1047788.1047807&partnerID=40&md5=c01d01435f9935b8e9077f8cecf1993a","University of Western Sydney, Parramatta, NSW, Australia","Gray, P.N., University of Western Sydney, Parramatta, NSW, Australia; Mann, S., University of Western Sydney, Parramatta, NSW, Australia","Abraham Fraunce (1588, pp. 125r-139r), a lawyer of Gray's Inn, proposed the earliest map of case reasoning, using Plowden's report of the Exchequer case of Earl of Northumberland (1567). In 29 pages of diagrams, he set out the legal logic components of (1) the arguments of the opposing parties, namely Queen Elizabeth I and the Earl and (2) the judgment of the Court. The original work, written in Norman French with some Latin, was translated by Sybil Jack (2002). An extract of the translation, here published for the first time, indicates that Fraunce was a forerunner of legal knowledge engineering. The Earl's case diagrams are not unlike the extensive structure of the Latent Damage Law legal advice tree constructed by Capper and Susskind (1988, p72) four hundred years later.",,"Case diagram; Case reasoning; Latent damage; Legal advice; Legal logic; Knowledge engineering; Laws and legislation; Case based reasoning","Gray, P. N.; University of Western Sydney, Parramatta, NSW, Australia",,,,1581137478; 9781581137477,85OAA,,"English","Proc Int Conf Artif Intell Law",Conference Paper,"Final","",Scopus,2-s2.0-77957775592
[No author name available],[No author id available],"5th International Conference on Case-Based Reasoning, ICCBR 2003",2003,"Lecture Notes in Computer Science (including subseries Lecture Notes in Artificial Intelligence and Lecture Notes in Bioinformatics)","2689",,,"1","733",,1,,"https://www.scopus.com/inward/record.uri?eid=2-s2.0-84958034331&partnerID=40&md5=1d551667a3a1ac7f4b88605464258ec0",,"","The proceedings contain 54 papers. The special focus in this conference is on Case-Based Reasoning. The topics include: Integrating case-based reasoning with knowledge construction and extension; on the role of the cases in case-based planning; progress in information extraction and NLP; a self-optimizing fuzzy tool for case-based reasoning; extracting performers’ behaviors to annotate cases in a CBR system for musical tempo transformations; case-based ranking for decision support systems; analogical reasoning for reuse of object-oriented specifications; combining case-based and model-based reasoning for predicting the outcome of legal cases; measuring the similarity of labeled graphs; a recommender system for supporting the sale of plastic resin; maximum likelihood hebbian learning based retrieval method for CBR systems; an evaluation of the usefulness of case-based explanation; adaptation guided retrieval based on formal concept analysis; case-based plan recognition in computer games; solution verification in software design; evaluation of case-based maintenance strategies in software design; optimal case-based refinement of adaptation rule bases for engineering design; detecting outliers using rule-based modeling for improving CBR-based software quality classification models; an empirical analysis of linear adaptation techniques for case-based prediction; a framework for historical case-based reasoning; an investigation of generalized cases; on the role of diversity in conversational recommender systems; similarity and compromise; evolution of a CBR system; diversity-conscious retrieval from generalized cases and an interpretive case-based reasoning approach.",,,,"Bridge D.G.Ashley K.D.","Springer Verlag",03029743,3540404333; 9783540450061,,,"English","Lect. Notes Comput. Sci.",Conference Review,"Final","",Scopus,2-s2.0-84958034331
"Branting L.Karl","6602085801;","Generative model of narrative cases",1999,"Proceedings of the International Conference on Artificial Intelligence and Law",,,,"1","8",,1,,"https://www.scopus.com/inward/record.uri?eid=2-s2.0-0033293478&partnerID=40&md5=70cb807095b32f18f674879914d3284a","Univ of Wyoming, Laramie, United States","Branting, L.Karl, Univ of Wyoming, Laramie, United States","Effective case-based reasoning in complex domains requires a representation that strikes a balance between expressiveness and tractability. For cases in temporal domains, formalization of event transitions in a narrative grammar can simplify both the user's task of problem formulation and the system's indexing, matching, and adaptation tasks without compromising expressiveness. This paper sets forth a model of temporal cases based on narrative grammars, demonstrates its applicability to several different domains, distinguishes two different similarity metrics - sequence overlap and tree overlap - and shows how the choice between these metrics depends on whether nonterminals in the narrative grammar correspond to abstract domain states or merely represent constraints on event transitions. The paper shows basic-level and legal-event narrative grammars can be used together to model how human lawyers interleave fact elicitation and analysis.",,"Computational grammars; Indexing (of information); Laws and legislation; Mathematical models; Case-based reasoning; Narrative grammars; Artificial intelligence","Branting, L.Karl; Univ of Wyoming, Laramie, United States",,"ACM, New York, NY, United States",,,85OAA,,"English","Proc Int Conf Artif Intell Law",Conference Paper,"Final","",Scopus,2-s2.0-0033293478
"Pal K., Campbell J.","9532428600;55470023600;","ASHSD-II: A computational model for litigation support",1998,"Expert Systems","15","3",,"169","181",,1,"10.1111/1468-0394.00075","https://www.scopus.com/inward/record.uri?eid=2-s2.0-0032140604&doi=10.1111%2f1468-0394.00075&partnerID=40&md5=c66ffbd3e6c1467430135715ff5082f9","Department of Computer Science, University College London, Gower Street, London WC1E 6BT, United Kingdom; Department of Computer Science, University College London, United Kingdom","Pal, K., Department of Computer Science, University College London, Gower Street, London WC1E 6BT, United Kingdom, Department of Computer Science, University College London, United Kingdom; Campbell, J., Department of Computer Science, University College London, Gower Street, London WC1E 6BT, United Kingdom, Department of Computer Science, University College London, United Kingdom","In this paper a hybrid knowledge-based system which exploits both rule-based reasoning (RBR) and case-based reasoning (CBR) is presented. The issues of RBR and CBR in general in the context of legal knowledge-based systems and legislation in rule form and previously-decided cases in an interconnected graph form are discussed. It is possible for the user to select either reasoning method (RBR or CBR), or indicate no preference. The rule base of this system consists of two types of rule. The first type of rule determines which options are legally applicable. The second type indicates how the courts are likely to act within the range of options available, which is determined by the first type of rule. When CBR is selected, the system uses the features of previously-decided cases to select the most similar cases to the situation that is described in the input and displays their details of decisions. In case of the selection of no preference option, the system applies RBR and CBR method separately, and then presents results based on an automated relative rating of the qualities of the RBR (based on the second type of rules) and CBR advice. These ideas have been implemented in a prototype system, known as Advisory Support for Home Settlement in Divorce (ASHSD-II).","Case-based reasoning; Hybrid system; Knowledge-based system; Law; Rule-based reasoning","Artificial intelligence; Computational methods; Computer systems programming; Decision theory; Graph theory; Laws and legislation; Mathematical models; Case-based reasoning (CBR); Legal knowledge based systems; Rule-based reasoning (RBR); Knowledge based systems","Pal, K.; Department of Computer Science, Gower Street, London WC1E 6BT, United Kingdom; email: P.Pal@cs.ucl.ac.uk",,"Blackwell Publishing Ltd",02664720,,EXSYE,,"English","Expert Syst",Article,"Final","",Scopus,2-s2.0-0032140604
"Yang S.-A., Robertson D., Lee J.","7408518249;57210541603;16316378200;","Use of case-based reasoning in the domain of building regulations",1995,"Lecture Notes in Computer Science (including subseries Lecture Notes in Artificial Intelligence and Lecture Notes in Bioinformatics)","984",,,"292","306",,1,"10.1007/3-540-60364-6_44","https://www.scopus.com/inward/record.uri?eid=2-s2.0-84958034326&doi=10.1007%2f3-540-60364-6_44&partnerID=40&md5=eeee408137f1a3454b74bb6b1736631e","Dept of Artificial Intelligence, University of Edinburgh, 80 South Bridge, Edinburgh, EH1 1HN, United Kingdom; EdCAAD and Human Communication Research Centre, Dept of Architecture, University of Edinlmrgh, 20 Chambers Street, Edinburgh, EH1 1JZ, United Kingdom","Yang, S.-A., Dept of Artificial Intelligence, University of Edinburgh, 80 South Bridge, Edinburgh, EH1 1HN, United Kingdom; Robertson, D., Dept of Artificial Intelligence, University of Edinburgh, 80 South Bridge, Edinburgh, EH1 1HN, United Kingdom; Lee, J., EdCAAD and Human Communication Research Centre, Dept of Architecture, University of Edinlmrgh, 20 Chambers Street, Edinburgh, EH1 1JZ, United Kingdom","In traditional legal decision support systems, it has been regarded as natural to represent statutes in terms of decision rules and to link these to a separate case-based reasoning system for handling precedent. Statutory legal rules used in these systems are formal and prescriptive. Building regulations in Scotland are part of statute law and constitute part of a legal system together with case histories. In recent years, the regulations have been becoming less prescriptive and more emphasis has been put onto the interpretive use of the regulations. In developing a system which can assist domain experts in interpreting the regulations, this trend has presented us with difficulties in employing this traditional approach and has led us to a unified case-based model of the regulations and case histories. In this paper, we first describe the characteristics of the regulations and the activities involved in this domain. Second, we explain the reason why we abandoned the traditional approach. Third, we describe the system which has been developed using this case-based model. © Springer-Verlag Berlin Heidelberg 1995.",,"Artificial intelligence; Building codes; Decision support systems; Laws and legislation; Building regulations; Case based reasoning systems; Case history; Decision rules; Domain experts; Legal rules; Legal system; Traditional approaches; Case based reasoning",,"Haton J.-P.Manago M.Keane M.","Springer Verlag",03029743,3540603646; 9783540603641,,,"English","Lect. Notes Comput. Sci.",Conference Paper,"Final","",Scopus,2-s2.0-84958034326
"Ziegler Haselein B., da Silva J.C.","57485487400;7201733212;","A knowledge-based system for electric motors compliance verification in a multinational-level company",2022,"Expert Systems",,,,"","",,,"10.1111/exsy.12979","https://www.scopus.com/inward/record.uri?eid=2-s2.0-85126185546&doi=10.1111%2fexsy.12979&partnerID=40&md5=dc13613008817aa2a2e159431d4c8e60","Department of Mechanical Engineering, Federal University of Santa Catarina, Santa Catarina, Florianopolis, Brazil","Ziegler Haselein, B., Department of Mechanical Engineering, Federal University of Santa Catarina, Santa Catarina, Florianopolis, Brazil; da Silva, J.C., Department of Mechanical Engineering, Federal University of Santa Catarina, Santa Catarina, Florianopolis, Brazil","Electric motors are highly customizable products that have to meticulously comply with the client's needs, commercial and legal requirements of each market. In this context, the configure-to-order (CTO) approach allows the user to define the product configuration at the time of the order and the supplier to develop a product that meets the customer's needs. This paper presents an object-oriented knowledge-based system (OOKBS) that integrates rule- and case-based reasoning to verify the compliance of a variant-rich and complex product—electric motors—in a multinational-level company. The system adopts a modular structure to evaluate distinct compliance aspects, such as technical constraints and commercial requirements, and to improve the compliance assessment based on the designs of motors previously sold. The work targeted a product line with significant market share in North America, and is the result of a collaboration among the following teams: product compliance, international sales, engineering systems, and product engineering. In total, the system development involved nine experts from these areas. This study has the originality of presenting a product configuration system (PCS) that integrates rule-based and case-based approaches to verify the compliance of a modular product. The results indicate a reduction of 73% of internal technical queries within the prototype scope. Moreover, the system usability tests highlight the completeness of outcomes, quick access to information, and easy integration of automatic product compliance verification into the company's design flow. Furthermore, we discussed how the system was effectively implemented in a design routine based on both concurrent engineering and CTO scenarios. © 2022 John Wiley & Sons Ltd.","compliance; electric motor; knowledge-based system; product configuration system","Case based reasoning; Commerce; Competition; Compliance control; Concurrent engineering; Electric motors; Product design; Commercial requirements; Compliance; Compliance verification; Configuration system; Customizable products; Knowledge-based systems; Multinational level; Product compliance; Product configuration; Product configuration system; Knowledge based systems","Ziegler Haselein, B.; Department of Mechanical Engineering, Santa Catarina, Brazil; email: haselein.bruno@gmail.com",,"John Wiley and Sons Inc",02664720,,EXSYE,,"English","Expert Syst",Article,"Article in Press","",Scopus,2-s2.0-85126185546
"Armgardt M.","36713035800;","A Formal Model for Analogies in Civil Law Reasoning",2022,"Logic, Argumentation and Reasoning","23",,,"171","183",,,"10.1007/978-3-030-70084-3_8","https://www.scopus.com/inward/record.uri?eid=2-s2.0-85122442602&doi=10.1007%2f978-3-030-70084-3_8&partnerID=40&md5=1da2fb8fc7e656fb355deead188f37e4","Department of Law, University of Hamburg, Hamburg, Germany","Armgardt, M., Department of Law, University of Hamburg, Hamburg, Germany","In his famous German paper “Juristische Schlüsse a fortiori und a pari” from 1965, Alchourron developed a model for analogies taking into consideration different types of legal rules. Taking this as a starting point we develop a formal model going deeper into jurisprudence by referring to balancing interests. This model deals with analogies based on a-fortiori-arguments, a-pari-arguments and a-simile-arguments. © 2022, Springer Nature Switzerland AG.","A simile arguments; Analogy; Case-based reasoning; Civil law; Interests; Legal gap",,"Armgardt, M.; Department of Law, Germany; email: matthias.armgardt@uni-hamburg.de",,"Springer Science and Business Media B.V.",22149120,,,,"English","Log. Argum. Reason.",Book Chapter,"Final","",Scopus,2-s2.0-85122442602
