"Ma Y., Zhang P., Ma J.","8348553300;36040790900;57204686839;","An Ontology Driven Knowledge Block Summarization Approach for Chinese Judgment Document Classification",2018,"IEEE Access","6",,"8537891","71327","71338",,16,"10.1109/ACCESS.2018.2881682","https://www.scopus.com/inward/record.uri?eid=2-s2.0-85056730809&doi=10.1109%2fACCESS.2018.2881682&partnerID=40&md5=674a87defdf9070e145f3b32dd2a12ab","School of Control and Computer Engineering, North China Electric Power University, Beijing, 102206, China; School of Law, Renmin University of China, Beijing, 100872, China","Ma, Y., School of Control and Computer Engineering, North China Electric Power University, Beijing, 102206, China; Zhang, P., School of Control and Computer Engineering, North China Electric Power University, Beijing, 102206, China; Ma, J., School of Law, Renmin University of China, Beijing, 100872, China","Efficient document classification techniques are crucial to current legal applications, such as case-based reasoning, legal citations, and so on. However, Chinese judgment documents are large and highly complex, so the traditional machine leaning-based classification models are often inefficient to Chinese document classification due to the fact that they fail to incorporate the overall structure and extra domain specific knowledge. In this paper, we propose an ontology-driven knowledge block summarization approach to computing document similarity for Chinese judgment document classification. First, the extra semantic knowledge for Chinese judgment documents is adopted from the perspectives of the top-level ontology and domain-specific ontologies, where how to merge the different kinds of ontologies together in an extensible manner is further represented. Second, the core semantic knowledge residing in Chinese judgment documents can be summarized into knowledge blocks by ontology-based information extraction. Third, we use Word Mover's Distance (WMD) is to calculate the similarity between different knowledge blocks instead of their original Chinese judgment documents. At last, the KNN-based experiments for Chinese judgment document classification were made to illustrate that our approach is more effective in achieving higher classification accuracy and has faster computation speed compared to the original WMD approach. © 2018 IEEE.","Document classification; document similarity; domain ontology; WMD","Case based reasoning; Classification (of information); Data mining; Information retrieval; Natural language processing systems; Neural networks; Ontology; Semantics; Classification accuracy; Computational model; Document Classification; Document similarity; Domain ontologies; Domain-specific knowledge; Domain-specific ontologies; Ontology-based information extraction; Information retrieval systems","Ma, Y.; School of Control and Computer Engineering, China; email: yinglongma@gmail.com",,"Institute of Electrical and Electronics Engineers Inc.",21693536,,,,"English","IEEE Access",Article,"Final","All Open Access, Gold",Scopus,2-s2.0-85056730809
"Walton D.N.","57203043668;","Argumentation Schemes for Argument from Analogy",2014,"Argumentation Library","25",,,"23","40",,16,"10.1007/978-3-319-06334-8_2","https://www.scopus.com/inward/record.uri?eid=2-s2.0-85094963439&doi=10.1007%2f978-3-319-06334-8_2&partnerID=40&md5=4c563faa628e6ddae77348757e59ebc5","Centre for Research in Reasoning, Argumentation and Rhetoric, University of Windsor, Windsor, ON, Canada","Walton, D.N., Centre for Research in Reasoning, Argumentation and Rhetoric, University of Windsor, Windsor, ON, Canada","In this paper I show how there are two different argumentation schemes for argument from analogy, and show by means of examples how each scheme applies to different cases in its own distinctive way. One scheme is based on similarity, while the other scheme is based on factors shared or not shared by two cases that are being compared. The problem confronted in the paper is to study how the two schemes fit together. Are there really two different schemes for argument from analogy, or is the one scheme an extension of the other that applies at a different dialectical stage of the argumentation in a case? Since argument from analogy is fundamental in case-based reasoning and legal reasoning, there is some discussion of how the schemes fit into both topics. © 2014, Springer International Publishing Switzerland.","Artificial intelligence; Case-based reasoning; Legal rhetoric; Scripts; Story schemes",,"Walton, D.N.; Centre for Research in Reasoning, Canada; email: waltoncrrar@gmail.com",,"Springer Nature",15667650,,,,"English","Argument. Lib.",Book Chapter,"Final","All Open Access, Green",Scopus,2-s2.0-85094963439
"Rissland Edwina L., Daniels Jody J.","6701660287;7202376659;","Hybrid CBR-IR approach to legal information retrieval",1995,"Proceedings of the International Conference on Artificial Intelligence and Law",,,,"52","61",,16,,"https://www.scopus.com/inward/record.uri?eid=2-s2.0-0029191240&partnerID=40&md5=db99771db75099374b3d6b7f7451ab1b","Univ of Massachusetts, Amherst, United States","Rissland, Edwina L., Univ of Massachusetts, Amherst, United States; Daniels, Jody J., Univ of Massachusetts, Amherst, United States","In this paper we discuss a hybrid approach combining Case-Based Reasoning (CBR) and Information Retrieval (IR) for the retrieval of legal documents. Our hybrid CBR-IR approach takes as input a standard symbolic representation of a problem case and retrieves texts of relevant cases from a document corpus dramatically larger than the case base available to the CBR system. Our system works by first performing a standard HYPO-style CBR analysis and then using texts associated with certain important classes of cases found in this analysis to 'seed' a modified version of INQUERY's relevance feedback mechanism in order to generate a query. Our approach provides two benefits: it extends the reach of CBR (for retrieval purposes) to much larger corpora, and it enables the injection of knowledge-based techniques into traditional IR. We describe our CBR-IR approach and report on on-going experiments performed in two different legal domains.",,"Database systems; Information retrieval; Information retrieval systems; Laws and legislation; Query languages; Case based reasoning; Legal information retrieval; Precedents; Knowledge based systems","Rissland, Edwina L.; Univ of Massachusetts, Amherst, United States","Anon","ACM, New York, NY, United States",,,85OAA,,"English","Proc Int Conf Artif Intell Law",Conference Paper,"Final","",Scopus,2-s2.0-0029191240
"Vossos G., Zeleznikow J., Vossos T.D.V.","16416085700;6701828144;57204195773;","An example of integrating legal case based reasoning with object-oriented rule-based systems: IKBALS II",1991,"Proceedings of the International Conference on Artificial Intelligence and Law",,,,"31","41",,16,"10.1145/112646.112650","https://www.scopus.com/inward/record.uri?eid=2-s2.0-84885911666&doi=10.1145%2f112646.112650&partnerID=40&md5=00d67f14b6a861ec214d6af991633ea7","Database Research Laboratory, Applied Computing Research Institute, La Trobe University, Bundoora, VIC  3083, Australia","Vossos, G., Database Research Laboratory, Applied Computing Research Institute, La Trobe University, Bundoora, VIC  3083, Australia; Zeleznikow, J., Database Research Laboratory, Applied Computing Research Institute, La Trobe University, Bundoora, VIC  3083, Australia; Vossos, T.D.V., Database Research Laboratory, Applied Computing Research Institute, La Trobe University, Bundoora, VIC  3083, Australia","Although case based reasoning (CBR) is still a research paradigm, it has been shown to offer significant advantages over conventional rulebased expert systems when attempting to reason through experience. This paper discusses extending an existing legal object-oriented/rulebased system to successfully handle CBR. In particular, we discuss the architecture of IKBALS H, a legal knowledge based system that performs statutory interpretation in the area of accident compensation. IKBALS II combines reasoning with rules and reasoning with previously tried precedent cases in order to determine if an injured employee is entitled to compensation under the Accident Compensation Act, 1985, Victoria. A worker is entitled to compensation only if the Accident Compensation Commission is satisfied that the worker falls within certain statutory definitions. © ACM.","Case based reasoning; Combining rulebased and case-based reasoning; Integrating case based reasoning into object oriented/rule based systems; Legal analogical reasoning; Legal knowledge based systems","Accidents; Expert systems; Analogical reasoning; Casebased reasonings (CBR); Legal case; Legal knowledge; Object oriented; Rule based; Rule-based expert system; Case based reasoning",,,"Association for Computing Machinery",,089791399X; 9780897913997,85OAA,,"English","Proc Int Conf Artif Intell Law",Conference Paper,"Final","",Scopus,2-s2.0-84885911666
"Walker R.F., Oskamp A., Schrickx J.A., Van Opdorp G.J., van den Berg P.H.","26434072500;6602281906;36965679100;25933688600;36880891600;","PROLEXS: Creating law and order in a heterogeneous domain",1991,"International Journal of Man-Machine Studies","35","1",,"35","67",,16,"10.1016/S0020-7373(07)80007-1","https://www.scopus.com/inward/record.uri?eid=2-s2.0-0343331606&doi=10.1016%2fS0020-7373%2807%2980007-1&partnerID=40&md5=9db2aff233133ea3b5e7d7dd2706a236","Computer/Law Institute, Vrije Universiteit, De Boelelaan 1105, 1081 HV Amsterdam, Netherlands","Walker, R.F., Computer/Law Institute, Vrije Universiteit, De Boelelaan 1105, 1081 HV Amsterdam, Netherlands; Oskamp, A., Computer/Law Institute, Vrije Universiteit, De Boelelaan 1105, 1081 HV Amsterdam, Netherlands; Schrickx, J.A., Computer/Law Institute, Vrije Universiteit, De Boelelaan 1105, 1081 HV Amsterdam, Netherlands; Van Opdorp, G.J., Computer/Law Institute, Vrije Universiteit, De Boelelaan 1105, 1081 HV Amsterdam, Netherlands; van den Berg, P.H., Computer/Law Institute, Vrije Universiteit, De Boelelaan 1105, 1081 HV Amsterdam, Netherlands","This article defines a heterogeneous domain as a domain in which typical problems can only be solved by combining several distinctive knowledge sources. The legal domain, in this view, must be considered heterogeneous since classical rule-based knowledge sources like legislation, cooperate with expertise and case-law, both possibly represented quite differently, to produce useful results. The article continues with the description of the architecture of PROLEXS, an expert system built to operate in such domains. An example dialogue is added to sketch the problems of building knowledge-based systems in heterogeneous domains and the way PROLEXS approaches those problems. Finally the current PROLEXS research involving neural networks and case-based reasoning is introduced. © 1991 Academic Press Limited.",,,"Walker, R.F.; Computer/Law Institute, Vrije Universiteit, De Boelelaan 1105, 1081 HV Amsterdam, Netherlands",,,00207373,,IJMMB,,"English","Int. J. Man-Mach. Stud.",Article,"Final","",Scopus,2-s2.0-0343331606
"Berman D.H., Hafner C.D.","7201609499;7004463232;","Incorporating procedural context into a model of case-based legal reasoning",1991,"Proceedings of the International Conference on Artificial Intelligence and Law",,,,"12","20",,15,"10.1145/112646.112648","https://www.scopus.com/inward/record.uri?eid=2-s2.0-0002773676&doi=10.1145%2f112646.112648&partnerID=40&md5=63444f805da7a315d8d2160fad4a781d","School of Law, Northeastern University, Boston, MA  02115, United States; College of Computer Science, Northeastern University, Boston, MA  02115, United States","Berman, D.H., School of Law, Northeastern University, Boston, MA  02115, United States; Hafner, C.D., College of Computer Science, Northeastern University, Boston, MA  02115, United States","In this paper we analyze the procedural considerations that affect the use of legal cases as precedents and propose a model of procedural knowledge that can be combined with substantive legal reasoning models to produce a more robust theory of case-based legal reasoning in common law jurisdictions. Our model addresses one component of procedural knowledge: the distinction between questions of fact and questions of law. We categorize 32 different procedural scenarios into 10 basic types of legal results. We then propose rules for determining the precedential value of these result types. Finally we suggest a method for incorporating procedural distinctions into case-based reasoning systems. © ACM.",,"Knowledge based systems; Case based; Case based reasoning systems; Common law; Legal case; Legal reasoning; Procedural knowledge; Case based reasoning",,,"Association for Computing Machinery",,089791399X; 9780897913997,85OAA,,"English","Proc Int Conf Artif Intell Law",Conference Paper,"Final","",Scopus,2-s2.0-0002773676
"Skalak D.B.","6506989205;","Taking advantage of models for legal classification",1989,"Proceedings of the International Conference on Artificial Intelligence and Law","Part F130177",,,"234","241",,15,"10.1145/74014.74044","https://www.scopus.com/inward/record.uri?eid=2-s2.0-0008205730&doi=10.1145%2f74014.74044&partnerID=40&md5=bf3cd28b953151460ca01ebeff372a3d","Department of Computer and Information Science, University of Massachusetts, Amherst, MA  01003, United States","Skalak, D.B., Department of Computer and Information Science, University of Massachusetts, Amherst, MA  01003, United States","Legal reasoning is often couched in terms of legal classification. We examine how three models of classification-Classical, Probabilistic and Exemplar-are used to perform legal classification. We argue that all three models of classification are implicitly applied by existing AI methods. The CABARET (""CAse-BAsed REasoning Tool"") system is suggested as an architecture that applies all three models. The relative difficulty of revising knowledge in rule form, in HYPO-style dimension form, and exemplar form is considered. © ACM.",,"Artificial intelligence; Case-based reasoning tools; Legal reasoning; Three models; Case based reasoning","Skalak, D.B.; Department of Computer and Information Science, United States; email: skalak@cs.umass.edu",,"Association for Computing Machinery",,0897913221,85OAA,,"English","Proc Int Conf Artif Intell Law",Conference Paper,"Final","",Scopus,2-s2.0-0008205730
"Grabmair M.","35179329700;","Predicting trade secret case outcomes using argument schemes and learned antitative value eect tradeos",2017,"Proceedings of the International Conference on Artificial Intelligence and Law",,,,"89","98",,14,"10.1145/3086512.3086521","https://www.scopus.com/inward/record.uri?eid=2-s2.0-85042760830&doi=10.1145%2f3086512.3086521&partnerID=40&md5=86ee41eace9dc7d685e782f79a2d2aab","Language Technologies Institute, School of Computer Science, Carnegie Mellon University, Pittsburgh, PA, United States","Grabmair, M., Language Technologies Institute, School of Computer Science, Carnegie Mellon University, Pittsburgh, PA, United States","This paper presents the Value Judgment Formalism and its experimental implementation in the VJAP system, which is capable of arguing about, and predicting outcomes of, a set of trade secret misappropriation cases. VJAP creates an argument graph for each case using argument schemes and a representation of values underlying trade secret law and eects of facts on these values. It balances eects on values in each case and analogizes it to tradeos in precedents. It predicts case outcomes using a condence measure computed from the graph and generates textual legal arguments justifying its predictions. The condence propagation uses quantitative weights learned from past cases using an iterative optimization method. Prediction performance on a limited dataset is competitive with common machine learning models. The results and VJAP’s behavior are discussed in detail. © 2017 Copyright held by the owner/author(s).","Articial intelligence & law; Case-based reasoning; Computational models of argument; Legal reasoning; Machine learning","Commerce; Forecasting; Iterative methods; Learning systems; Computational model; Iterative Optimization; Legal arguments; Legal reasoning; Machine learning models; Predicting outcomes; Prediction performance; Quantitative weights; Case based reasoning","Grabmair, M.; Language Technologies Institute, United States",,"Association for Computing Machinery",,9781450348911,85OAA,,"English","Proc Int Conf Artif Intell Law",Conference Paper,"Final","",Scopus,2-s2.0-85042760830
"Prabhakharan P., Molesworth B.R.C.","37091351700;6506721324;","Repairing faulty scripts to reduce speeding behaviour in young drivers",2011,"Accident Analysis and Prevention","43","5",,"1696","1702",,13,"10.1016/j.aap.2011.03.028","https://www.scopus.com/inward/record.uri?eid=2-s2.0-79958216375&doi=10.1016%2fj.aap.2011.03.028&partnerID=40&md5=53de9e20b0f29dab5f954c19ad11503a","School of Aviation, University of New South Wales, Old Main Building, Sydney, NSW 2052, Australia","Prabhakharan, P., School of Aviation, University of New South Wales, Old Main Building, Sydney, NSW 2052, Australia; Molesworth, B.R.C., School of Aviation, University of New South Wales, Old Main Building, Sydney, NSW 2052, Australia","Background: Young drivers under the age of 25 throughout the world continue to be over-represented in motor vehicle accidents (WHO, 2007). A contributing factor to a large number of these motor vehicle accidents is speeding. Reducing drivers' tendency to speed remains a challenge. In aviation, one method that has yielded positive results in terms of improving pilots' risk management behaviour involves engaging pilots cognitively in the task (Molesworth et al.; 2006). This type of training is hypothesized to repair faulty cognitive structures known as scripts. Therefore, the main aim of the present research was to examine the utility of a training program where drivers are actively engaged following a driving episode by giving them personalised feedback in order to reduce their tendency to speed. Method: 58 young (16-24 years) motorists were divided into four groups. All participants completed both a 'training' session followed by a test session one week apart. Training consisted of either, reading three accident cases involving speeding, cases with rules associated with the offence, a simulated drive with personalised post-drive feedback regarding speeding and its legal ramifications or a card sorting task (control). The main dependent variables were percentage of distance speeding and frequency of zone violations during the simulated drive in the test session. Results: A series of planned contrast analysis with family-wise error corrected at .017 revealed that receiving personalised feedback regarding speeding behaviour following a simulated drive significantly reduced speeding tendency in the test session, when compared to control. Reading case examples alone, or coupled with rules, appeared to have no impact on speeding behaviour, compared to control. Conclusion: The results suggest that training programs that actively engage individuals about a driving episode by providing them with personalised feedback may be effective in curbing young drivers' speeding behaviour. These results are discussed from a theoretical and applied perspective. © 2011 Elsevier Ltd. All rights reserved.","Case-based reasoning; Episodic training; Event schemas; Scripts; Speeding; Young drivers","Episodic training; Schemas; Scripts; Speeding; Young driver; Accidents; Automobile drivers; Crime; Personnel training; Risk management; Vehicles; Behavioral research; adolescent; adult; article; car driving; child behavior; computer simulation; driver licence; education; female; high risk behavior; human; legal aspect; male; problem based learning; psychological aspect; questionnaire; violence; Adolescent; Adolescent Behavior; Automobile Driver Examination; Automobile Driving; Computer Simulation; Dangerous Behavior; Female; Humans; Male; Problem-Based Learning; Questionnaires; Risk-Taking; Young Adult","Prabhakharan, P.; School of Aviation, , Sydney, NSW 2052, Australia; email: p.prabhakharan@unsw.edu.au",,,00014575,,AAPVB,"21658496","English","Accid. Anal. Prev.",Article,"Final","",Scopus,2-s2.0-79958216375
"Bex F., Bench-Capon T., Verheij B.","19337095300;7004514001;6602409964;","What makes a story plausible? The need for precedents",2011,"Frontiers in Artificial Intelligence and Applications","235",,,"23","32",,13,"10.3233/978-1-60750-981-3-23","https://www.scopus.com/inward/record.uri?eid=2-s2.0-83655193532&doi=10.3233%2f978-1-60750-981-3-23&partnerID=40&md5=575ce6465a66301992e446f5be679a33","School of Computing, University of Dundee, Dundee DD1 4HN, United Kingdom; Department of Computer Science, University of Liverpool, United Kingdom; Department of Artificial Intelligence, University of Groningen, Netherlands","Bex, F., School of Computing, University of Dundee, Dundee DD1 4HN, United Kingdom; Bench-Capon, T., Department of Computer Science, University of Liverpool, United Kingdom; Verheij, B., Department of Artificial Intelligence, University of Groningen, Netherlands","When reasoning about the facts of a case, we typically use stories to link the known events into coherent wholes. One way to establish coherence is to appeal to past examples, real or fictitious. These examples can be chosen and critiqued using the case-based reasoning (CBR) techniques from the AI and Law literature. In this paper, we apply these techniques to factual stories, assessing a story about the facts using precedents. We thus show how factual and legal reasoning can be combined in a CBR model. © 2011 The authors and IOS Press. All rights reserved.","argumentation; case-based reasoning; precedents; Stories","Laws and legislation; AI and law; argumentation; Casebased reasonings (CBR); CBr; Legal reasoning; precedents; Stories; Case based reasoning","Bex, F.; School of Computing, , Dundee DD1 4HN, United Kingdom; email: florisbex@computing.dundee.ac.uk",,"IOS Press",09226389,9781607509806,,,"English","Front. Artif. Intell. Appl.",Conference Paper,"Final","",Scopus,2-s2.0-83655193532
"Ashley K.D.","7005232254;","Teaching a process model of legal argument with hypotheticals",2009,"Artificial Intelligence and Law","17","4",,"321","370",,13,"10.1007/s10506-009-9083-y","https://www.scopus.com/inward/record.uri?eid=2-s2.0-72149094583&doi=10.1007%2fs10506-009-9083-y&partnerID=40&md5=289893a234da480df6eb8d6a5a8d9019","Learning Research and Development Center, University of Pittsburgh, Pittsburgh, PA, United States","Ashley, K.D., Learning Research and Development Center, University of Pittsburgh, Pittsburgh, PA, United States","The research described here explores the idea of using Supreme Court oral arguments as pedagogical examples in first year classes to help students learn the role of hypothetical reasoning in law. The article presents examples of patterns of reasoning with hypotheticals in appellate legal argument and in the legal classroom and a process model of hypothetical reasoning that relates them to work in cognitive science and Artificial Intelligence. The process model describes the relationships between an advocate's proposed test for deciding a case or issue, the facts of the hypothetical and of the case to be decided, and the often conflicting legal principles and policies underlying the issue. The process model of hypothetical reasoning has been partially implemented in a computerized teaching environment, LARGO (""Legal ARgument Graph Observer"") that helps students identify, analyze, and reflect on episodes of hypothetical reasoning in oral argument transcripts. Using LARGO, students reconstruct examples of hypothetical reasoning in the oral arguments by representing them in simple diagrams that focus students on the proposed test, the hypothetical challenge to the test, and the responses to the challenge. The program analyzes the diagrams and provides feedback to help students complete the diagrams and reflect on the significance of the hypothetical reasoning in the argument. The article reports the results of experiments evaluating instruction of first year law students at the University of Pittsburgh using the LARGO program as applied to Supreme Court personal jurisdiction cases. The learning results so far have been mixed. Instruction with LARGO has been shown to help law student volunteers with lower LSAT scores learn skills and knowledge regarding hypothetical reasoning better than a text-based approach, but not when the students were required to participate. On the other hand, the diagrams students produce with LARGO have been shown to have some diagnostic value, distinguishing among law students on the basis of LSAT scores, posttest performance, and years in law school. This lends support to the underlying model of hypothetical argument and suggests using LARGO as a pedagogically diagnostic tool. © 2009 Springer Science+Business Media B.V.","Argument diagrams; Case-based reasoning; Hypothetical reasoning; Intelligent tutoring; Modeling legal argument","Cognitive science; Diagnostic tools; Diagnostic value; First year; Hypothetical reasoning; Intelligent tutoring; Law schools; Legal principles; Process model; Student volunteers; Supreme Court; Text-based approach; University of Pittsburgh; Artificial intelligence; Graphic methods; Process monitoring; Students; Teaching; Case based reasoning","Ashley, K. D.; Learning Research and Development Center, , Pittsburgh, PA, United States; email: ashley@pitt.edu",,,09248463,,AINLE,,"English","Artif Intell Law",Article,"Final","",Scopus,2-s2.0-72149094583
