"Han H., Li R., Hu J., Qiu M.","24483248500;7404724385;7406419926;12791777800;","Context Awareness through Reasoning on Private Analysis for Android Application",2016,"Proceedings - 2nd IEEE International Conference on Cyber Security and Cloud Computing, CSCloud 2015 - IEEE International Symposium of Smart Cloud, IEEE SSC 2015",,,"7371474","148","156",,4,"10.1109/CSCloud.2015.63","https://www.scopus.com/inward/record.uri?eid=2-s2.0-84962878017&doi=10.1109%2fCSCloud.2015.63&partnerID=40&md5=2f7d859984cd78af8bc006a3667f0cc8","School of Computer Science and Technology, Huazhong University of Science and Technology, Wuhan, 430074, China; Department of Computer Science, TU Darmstadt, Darmstadt, D-64289, Germany; Department of Computer Science, Pace University, New York, United States","Han, H., School of Computer Science and Technology, Huazhong University of Science and Technology, Wuhan, 430074, China; Li, R., School of Computer Science and Technology, Huazhong University of Science and Technology, Wuhan, 430074, China; Hu, J., Department of Computer Science, TU Darmstadt, Darmstadt, D-64289, Germany; Qiu, M., Department of Computer Science, Pace University, New York, United States","Smartphone contains diverse sensitive private information, such as phone number, contact and credit. The Android platform employs permission mechanism to protect intensive information from illegal leakage. There are several tools to assist users to manage apps' permissions, such as App Ops, Privacy Guard, and XPrivacy. However, the permission mechanism of Android is complicated, and only a few of smartphone users are familiar with Android security mechanism. In addition, it is difficult for smartphone users to know whether the privacy information exposure by Android applications is legal or not. Reverse engineering and program data flow analysis are basic approaches to analysis applications. Although it needs analysts to manual analysis results, its efficiency is largely depends on analysts' skills and experience. To improve analysis efficiency, we take a case-based reasoning method to simulation the security expert analysis applications. We translate the result of Android static analysis tools into cases and build a case reasoning library. Experiments show that it can help analysts to aid analysis Android applications. © 2015 IEEE.","Android; case based reasoning; privacy leakage; security; static analysis","Android (operating system); Application programs; Case based reasoning; Cloud computing; Data flow analysis; Efficiency; Reverse engineering; Signal encoding; Smartphones; Static analysis; Android; Android applications; Android securities; Context- awareness; Privacy information; Privacy leakages; Private information; security; Mobile security",,"Zhang T.Das S.K.Zhang T.Qiu M.","Institute of Electrical and Electronics Engineers Inc.",,9781467392990,,,"English","Proc. - IEEE Int. Conf. Cyber Secur. Cloud Comput., CSCloud: IEEE Int. Symp. of Smart Cloud IEEE SSC",Conference Paper,"Final","",Scopus,2-s2.0-84962878017
"Hage J.","7102834735;","Legal Reasoning and Legal Integration",2003,"Maastricht Journal of European and Comparative Law","10","1",,"67","97",,4,"10.1177/1023263X0301000104","https://www.scopus.com/inward/record.uri?eid=2-s2.0-33646872323&doi=10.1177%2f1023263X0301000104&partnerID=40&md5=91e36eba16cf3eec7d04b128ae8ec4e0","Maastricht University, Netherlands","Hage, J., Maastricht University, Netherlands","According to Legrand, harmonization of European private law by means of a European Civil Code would not work, because of the different legal cultures (mentalités) within which such a code would have to operate. In the civil law tradition, legal reasoning on the basis of such a code would be deductive in the sense of the application of rules that are posited prior to the cases to which they should be applied. In the common law tradition, the starting point of legal reasoning is in the cases themselves. As a consequence, common law reasoning would abstract less from the peculiarities of individual cases. The main point of this paper is that Legrand's picture of civil law reasoning is based on the subsumption model of rule application, which does not allow adaptation of the law to the needs of concrete cases other than through the limited possibilities of interpretation. It is argued that this picture is wrong. As an alternative, the reason-based model of rule application is proposed, which allows legal decision makers much more leeway to tailor the law to the needs of concrete cases. In a comparison with case-based reasoning it is argued that rule-based reasoning, according to the reason-based model, gives the decision maker the same leeway. The final conclusion is that possible differences in legal culture between the civil law and the common law tradition are not rooted in the distinction between rule-based reasoning and case-based reasoning, and are therefore merely contingent. There is no reason why the introduction of a European Civil Code could not overcome the differences between the two traditions. Whether this would be desirable is a different question. © 2003 SAGE Publications.",,,"Hage, J.; Maastricht UniversityNetherlands",,"SAGE Publications Ltd",1023263X,,,,"English","Maastricht J. Eur.Comp. Law",Article,"Final","",Scopus,2-s2.0-33646872323
"Mamaghani F.","6508231316;","Information technology knowledge sharing using case-based reasoning",2002,"Information Systems Management","19","4",,"13","20",,4,"10.1201/1078/43202.19.4.20020901/38831.3","https://www.scopus.com/inward/record.uri?eid=2-s2.0-0036732463&doi=10.1201%2f1078%2f43202.19.4.20020901%2f38831.3&partnerID=40&md5=df6d0d185e999efa571f420974208ada","St. John Fisher College, Rochester, NY, United States","Mamaghani, F., St. John Fisher College, Rochester, NY, United States","In the relatively short time since the first case-based reasoning systems were implemented, there have been numerous academic CBR demonstrators. CBR systems have been used in diagnosis of diseases, planning, legal reasoning, software design, arbitration, weather forecasting, tutoring, and help desk operations, to name a few. © 2002, Taylor & Francis Group, LLC.",,"Computer aided software engineering; Data structures; Database systems; Decision making; Formal logic; Indexing (of information); Information management; Information technology; Knowledge representation; Problem solving; Statistical methods; Case-based reasoning (CBR); Management information systems","Mamaghani, F.; St. John Fisher College, Rochester, NY, United States",,,10580530,,,,"English","Inf. Syst. Manage.",Article,"Final","",Scopus,2-s2.0-0036732463
"Kerner Yaakov HaCohen, Schild Uri, Zeleznikow John","6507568999;6602569291;6701828144;","Developing computational models of discretion to build legal knowledge based systems",1999,"Proceedings of the International Conference on Artificial Intelligence and Law",,,,"206","213",,4,"10.1145/323706.323799","https://www.scopus.com/inward/record.uri?eid=2-s2.0-0033295260&doi=10.1145%2f323706.323799&partnerID=40&md5=904cf49c52c4b6d3e6986b9172aacea1","Jerusalem Coll of Technology, Jerusalem, Israel","Kerner, Yaakov HaCohen, Jerusalem Coll of Technology, Jerusalem, Israel; Schild, Uri, Jerusalem Coll of Technology, Jerusalem, Israel; Zeleznikow, John, Jerusalem Coll of Technology, Jerusalem, Israel","Few legal knowledge based systems have been constructed which provide numerical advice. None have been built in discretionary domains. Our research, directed towards the domains of sentencing and family law property division has lead to the development of three distinct forms of judicial discretion. To model these different discretionary domains we use diverse artificial intelligence tools including case-based reasoning and knowledge discovery from databases. We carry out a detailed comparison of two discretionary legal knowledge based systems. Judge's Apprentice is a case-based reasoner which recommends ranges of sentences for convicted Israeli rapists and robbers. SplitUp uses Knowledge Discovery from Databases to learn what percentage of marital property the partners to a divorce in Australia will receive. The systems are compared with regard to reasoning, explanation, evaluation and coping with conflicting cases.",,"Artificial intelligence; Database systems; Knowledge acquisition; Laws and legislation; Legal knowledge based systems; Knowledge based systems","Kerner, Yaakov HaCohen; Jerusalem Coll of Technology, Jerusalem, Israel",,"ACM, New York",,,85OAA,,"English","Proc Int Conf Artif Intell Law",Conference Paper,"Final","",Scopus,2-s2.0-0033295260
"Rissland Edwina L., Skalak David B., Friedman M.Timur","6701660287;6506989205;57203176529;","Heuristic harvesting of information for case-based argument",1994,"Proceedings of the National Conference on Artificial Intelligence","1",,,"36","43",,4,,"https://www.scopus.com/inward/record.uri?eid=2-s2.0-0028603239&partnerID=40&md5=b7dda81c0c54488ef57a37fdaf4629c5","Univ of Massachusetts, Amherst, United States","Rissland, Edwina L., Univ of Massachusetts, Amherst, United States; Skalak, David B., Univ of Massachusetts, Amherst, United States; Friedman, M.Timur, Univ of Massachusetts, Amherst, United States","The BankXXX system models the process of perusing and gathering information for argument as a heuristic best-first search for relevant cases, theories, and other domain-specific information. As BankXX searches its heterogeneous and highly interconnected network of domain knowledge, information is incrementally analyzed and amalgamated into a dozen desirable ingredients for argument (called argument pieces), such as citations to cases, applications of legal theories, and references to prototypical factual scenarios. At the conclusion of the search, BankXX outputs the set of argument pieces filled with harvested material relevant to the input problem situation. This research explores the appropriateness of the search paradigm as a framework for harvesting and mining information needed to make legal arguments. We discuss how we tackled the problem of evaluation of BankXX from both the case-based reasoning (CBR) and task-performance perspectives. In particular, we discuss how various system parameters - start node, evaluation function, resource limit - affected BankXX from the CBR perspective and how well BankXX performs its assigned task of gathering information useful for legal argumentation by running BankXX on real legal cases and comparing its output with the published court opinions for those cases.",,"Artificial intelligence; Computer networks; Function evaluation; Heuristic methods; Information retrieval systems; Storage allocation (computer); Systems analysis; Case based argument; Domain knowledge; Information heuristic harvesting; Interconnected network; Task performance perspectives; Knowledge based systems","Rissland, Edwina L.; Univ of Massachusetts, Amherst, United States",,"AAAI, Menlo Park, CA, United States",,,PNAIE,,"English","Proc Natl Conf Artif Intell",Conference Paper,"Final","",Scopus,2-s2.0-0028603239
"Nitta K., Ohtake Y., Maeda S., Ono M., Ohsaki H., Sakane K.","7201659007;7005292457;55730730400;7403148412;36869256300;7003419452;","HELIC-II: Legal reasoning system on the parallel inference machine",1993,"New Generation Computing","11","3-4",,"423","448",,4,"10.1007/BF03037186","https://www.scopus.com/inward/record.uri?eid=2-s2.0-77951506887&doi=10.1007%2fBF03037186&partnerID=40&md5=defb2415c535b41e5b2c87f641663dc6","Institute for New Generation Computer Technology, 4-28, Mita 1-chome, Minato-ku, Tokyo, 108, Japan; Japan Information Processing Development Center, Japan; Nippon Steel Corporation, Japan","Nitta, K., Institute for New Generation Computer Technology, 4-28, Mita 1-chome, Minato-ku, Tokyo, 108, Japan; Ohtake, Y., Institute for New Generation Computer Technology, 4-28, Mita 1-chome, Minato-ku, Tokyo, 108, Japan; Maeda, S., Institute for New Generation Computer Technology, 4-28, Mita 1-chome, Minato-ku, Tokyo, 108, Japan; Ono, M., Institute for New Generation Computer Technology, 4-28, Mita 1-chome, Minato-ku, Tokyo, 108, Japan; Ohsaki, H., Japan Information Processing Development Center, Japan; Sakane, K., Nippon Steel Corporation, Japan","This paper presents HELIC-II, a legal reasoning system on the parallel inference machine. HELIC-II draws legal conclusions for a given case by referring to a statutory law (legal rules) and judicial precedents (old cases). This system consists of two inference engines. The rule-based engine draws legal consequences logically by using legal rules. The case-based engine generates legal concepts by referencing similar old cases. These engines complementally draw all possible conclusions, and output them in the form of inference trees. Users can use these trees as material to construct arguments in a legal suit. HELIC-II is implemented on the parallel inference machine, and it can draw conclusions quickly by parallel inference. As an example, a legal inference system for the Penal Code is introduced, and the effectiveness of the legal reasoning and parallel inference model is shown. © 1993 Ohmsha, Ltd. and Springer.","Case-Based Reasoning Analogy; Debate; Legal Reasoning; Negation as Failure; Parallel Inference; Theorem Prover",,"Nitta, K.; Institute for New Generation Computer Technology, 4-28, Mita 1-chome, Minato-ku, Tokyo, 108, Japan",,,02883635,,NGCOE,,"English","New Gener Comput",Article,"Final","",Scopus,2-s2.0-77951506887
"Mefford D.","36470453300;","Case-based reasoning, legal reasoning, and the study of politics",1990,"Political Behavior","12","2",,"125","158",,4,"10.1007/BF00992466","https://www.scopus.com/inward/record.uri?eid=2-s2.0-0040150003&doi=10.1007%2fBF00992466&partnerID=40&md5=b076279910f1f28a68a2d998d5849e4e","Department of Political Science, The Ohio State University, 223 Derby Hall, 154 N. Oval Mall, Columbus, 43210-1373, OH, United States","Mefford, D., Department of Political Science, The Ohio State University, 223 Derby Hall, 154 N. Oval Mall, Columbus, 43210-1373, OH, United States","Case-based reasoning (CBR) is an active area of research within artificial intelligence that emphasizes the function of memory in problem-solving. It proceeds from the premise that people cope with new problems or situations by reusing the strategies that have proved effective in similar situations in the past. Rather than deduction or the application of rules, the basic inferential process is that of recognition. Because the reasoning characteristic of politics is largely of this type, we suggest that the concepts and formalisms developed within this branch of artificial intelligence can be usefully applied to the study of political institutions and political behavior. But we argue, critically, that if CBR is to be applied to politics, it must be generalized to accommodate multiple agents who act repeatedly in multiple tasks. We outline what these extensions to CBR would involve, using the history of liability in tort law as a worked example. © 1990 Plenum Publishing Corporation.",,,"Mefford, D.; Department of Political Science, 223 Derby Hall, 154 N. Oval Mall, Columbus, 43210-1373, OH, United States",,"Kluwer Academic Publishers-Plenum Publishers",01909320,,,,"English","Polit Behav",Article,"Final","",Scopus,2-s2.0-0040150003
"Mandal A., Ghosh K., Ghosh S., Mandal S.","57198886280;55364599300;56004548600;57212403237;","Unsupervised approaches for measuring textual similarity between legal court case reports",2021,"Artificial Intelligence and Law","29","3",,"417","451",,3,"10.1007/s10506-020-09280-2","https://www.scopus.com/inward/record.uri?eid=2-s2.0-85098963328&doi=10.1007%2fs10506-020-09280-2&partnerID=40&md5=94d858c5cacedc14739d4f27a113c98e","Department of Computer Science and Technology, Indian Institute of Engineering Science and Technology, Howrah, Shibpur, India; Department of Computational and Data Sciences (CDS), Indian Institutes of Science Education and Research, Kolkata, West Bengal, India; Department of Computer Science and Engineering, Indian Institute of Technology Kharagpur, Kharagpur, West Bengal, India","Mandal, A., Department of Computer Science and Technology, Indian Institute of Engineering Science and Technology, Howrah, Shibpur, India; Ghosh, K., Department of Computational and Data Sciences (CDS), Indian Institutes of Science Education and Research, Kolkata, West Bengal, India; Ghosh, S., Department of Computer Science and Engineering, Indian Institute of Technology Kharagpur, Kharagpur, West Bengal, India; Mandal, S., Department of Computer Science and Technology, Indian Institute of Engineering Science and Technology, Howrah, Shibpur, India","In the domain of legal information retrieval, an important challenge is to compute similarity between two legal documents. Precedents (statements from prior cases) play an important role in The Common Law system, where lawyers need to frequently refer to relevant prior cases. Measuring document similarity is one of the most crucial aspects of any document retrieval system which decides the speed, scalability and accuracy of the system. Text-based and network-based methods for computing similarity among case reports have already been proposed in prior works but not without a few pitfalls. Since legal citation networks are generally highly disconnected, network based metrics are not suited for them. Till date, only a few text-based and predominant embedding based methods have been employed, for instance, TF-IDF based approaches, Word2Vec (Mikolov et al. 2013) and Doc2Vec (Le and Mikolov 2014) based approaches. We investigate the performance of 56 different methodologies for computing textual similarity across court case statements when applied on a dataset of Indian Supreme Court Cases. Among the 56 different methods, thirty are adaptations of existing methods and twenty-six are our proposed methods. The methods studied include models such as BERT (Devlin et al. 2018) and Law2Vec (Ilias 2019). It is observed that the more traditional methods (such as the TF-IDF and LDA) that rely on a bag-of-words representation performs better than the more advanced context-aware methods (like BERT and Law2Vec) for computing document-level similarity. Finally we nominate, via empirical validation, five of our best performing methods as appropriate for measuring similarity between case reports. Among these five, two are adaptations of existing methods and the other three are our proposed methods. © 2021, The Author(s), under exclusive licence to Springer Nature B.V. part of Springer Nature.","BERT; Court case reports; Court case similarity; Doc2vec; Law2vec; Legal information retrieval; Topic modeling; Word2vec","Artificial intelligence; Management; Citation networks; Document similarity; Empirical validation; Legal documents; Legal information retrieval; Measuring similarities; Textual similarities; Unsupervised approaches; Information retrieval","Mandal, A.; Department of Computer Science and Technology, India; email: amarnamarpan@gmail.com",,"Springer Science and Business Media B.V.",09248463,,AINLE,,"English","Artif Intell Law",Article,"Final","",Scopus,2-s2.0-85098963328
"Zhang H., Zhang Z., Zhou L., Wu S.","57211520730;57211006411;56587100100;57219483497;","Case-based reasoning for hidden property analysis of judgment debtors",2021,"Mathematics","9","13","1559","","",,3,"10.3390/math9131559","https://www.scopus.com/inward/record.uri?eid=2-s2.0-85110347542&doi=10.3390%2fmath9131559&partnerID=40&md5=9023ba94062206b70db75bcae4a03372","School of Labor Relationship, Shandong Management University, Jinan, 250357, China; School of Automation, Nanjing University of Science and Technology, Nanjing, 210094, China; Business School, University of Shanghai for Science and Technology, Shanghai, 200093, China; School of Economics and Management, Tongji University, Shanghai, 200092, China","Zhang, H., School of Labor Relationship, Shandong Management University, Jinan, 250357, China; Zhang, Z., School of Automation, Nanjing University of Science and Technology, Nanjing, 210094, China; Zhou, L., Business School, University of Shanghai for Science and Technology, Shanghai, 200093, China; Wu, S., School of Economics and Management, Tongji University, Shanghai, 200092, China","Many judgment debtors try to evade, confront, and delay law enforcement using concealing and transferring their property to resist law enforcement in China. The act of hiding property seriously affects people’s legitimate rights and interests and China’s legal authority. Therefore, it is essential to find an effective method of analyzing whether a judgment debtor hides property. Aiming at the hidden property analysis problem, we propose a case-based reasoning method for the judgment debtor’s hidden property analysis. In the hidden property analysis process, we present the attributes of the enforcement case by crisp symbols, crisp numbers, interval numbers, and fuzzy linguistic variables and develop a hybrid similarity measure between the historical enforcement case and the target enforcement case. The results show that the recommendations obtained with the information and knowledge of similar historical cases are consistent with judicial practice, which can reduce the work pressure of law enforcement officers and improve the efficiency of handling enforcement cases. © 2021 by the authors. Licensee MDPI, Basel, Switzerland.","Case-based reasoning (CBR); Hidden property; Judgment debtor; Law enforcement; Similarity measure",,"Zhou, L.; Business School, China; email: zhoulixin1861@hotmail.com",,"MDPI AG",22277390,,,,"English","Mathematics",Article,"Final","All Open Access, Gold",Scopus,2-s2.0-85110347542
"Odekerken D., Bex F.","57211168405;19337095300;","Towards transparent human-in-the-loop classification of fraudulent web shops",2020,"Frontiers in Artificial Intelligence and Applications","334",,,"239","242",,3,"10.3233/FAIA200873","https://www.scopus.com/inward/record.uri?eid=2-s2.0-85098653155&doi=10.3233%2fFAIA200873&partnerID=40&md5=b7ff03ab3f73213a020642e358c6fff4","Department of Information and Computing Sciences, Utrecht University, Netherlands; National Police Lab Ai, Netherlands Police, Netherlands; Tilburg Institute for Law, Technology and Society, Tilburg University, Netherlands","Odekerken, D., Department of Information and Computing Sciences, Utrecht University, Netherlands, National Police Lab Ai, Netherlands Police, Netherlands; Bex, F., Department of Information and Computing Sciences, Utrecht University, Netherlands, Tilburg Institute for Law, Technology and Society, Tilburg University, Netherlands","We propose an agent architecture for transparent human-in-the-loop classification. By combining dynamic argumentation with legal case-based reasoning, we create an agent that is able to explain its decisions at various levels of detail and adapts to new situations. It keeps the human analyst in the loop by presenting suggestions for corrections that may change the factors on which the current decision is based and by enabling the analyst to add new factors. We are currently implementing the agent for classification of fraudulent web shops at the Dutch Police. © 2020 The Authors, Faculty of Law, Masaryk University and IOS Press.","Dynamic argumentation; Law enforcement; Legal case-based reasoning","Information systems; Information use; Agent architectures; Human-in-the-loop; Legal case; Levels of detail; Web shop; Case based reasoning",,"Villata S.Harasta J.Kremen P.","IOS Press BV",09226389,9781643681504,,,"English","Front. Artif. Intell. Appl.",Conference Paper,"Final","All Open Access, Hybrid Gold, Green",Scopus,2-s2.0-85098653155
